[
  {
    "cdm_id": "CDM-2024-001-STARLINK-FY1C",
    "creation_date": "2024-01-18T10:30:00Z",
    "originator": "JSpOC",
    "message_for": "STARLINK-1234",
    "tca": "2024-01-20T08:30:00Z",
    "miss_distance_m": 150.0,
    "collision_probability": 1.2e-4,
    "object1": {
      "object_id": "12345",
      "object_name": "STARLINK-1234",
      "object_type": "PAYLOAD",
      "operator_organization": "SpaceX",
      "ephemeris_name": "DEFINITIVE",
      "covariance_method": "MONTE_CARLO",
      "maneuverable": true,
      "catalog_source": "18SDS",
      "position_x_km": 6778.137,
      "position_y_km": 0.0,
      "position_z_km": 0.0,
      "velocity_x_km_s": 0.0,
      "velocity_y_km_s": 7.67,
      "velocity_z_km_s": 0.0
    },
    "object2": {
      "object_id": "99999",
      "object_name": "FENGYUN-1C-DEB",
      "object_type": "DEBRIS",
      "operator_organization": null,
      "ephemeris_name": "ESTIMATED",
      "covariance_method": "MONTE_CARLO",
      "maneuverable": false,
      "catalog_source": "18SDS",
      "position_x_km": 6778.287,
      "position_y_km": 0.0,
      "position_z_km": 0.0,
      "velocity_x_km_s": 0.0,
      "velocity_y_km_s": -7.65,
      "velocity_z_km_s": 0.0
    },
    "relative_state": {
      "relative_speed_m_s": 15320.0,
      "relative_position_r_km": 0.15,
      "relative_position_t_km": 0.0,
      "relative_position_n_km": 0.0
    },
    "screening_data": {
      "screening_volume_type": "ELLIPSOID",
      "hard_body_radius_m": 15.0
    }
  },
  {
    "cdm_id": "CDM-2024-002-ONEWEB-COSMOS",
    "creation_date": "2024-01-19T14:00:00Z",
    "originator": "JSpOC",
    "message_for": "ONEWEB-0123",
    "tca": "2024-01-22T14:15:00Z",
    "miss_distance_m": 500.0,
    "collision_probability": 5.0e-6,
    "object1": {
      "object_id": "54321",
      "object_name": "ONEWEB-0123",
      "object_type": "PAYLOAD",
      "operator_organization": "OneWeb",
      "ephemeris_name": "DEFINITIVE",
      "covariance_method": "MONTE_CARLO",
      "maneuverable": true,
      "catalog_source": "18SDS",
      "position_x_km": 7578.137,
      "position_y_km": 0.0,
      "position_z_km": 0.0,
      "velocity_x_km_s": 0.0,
      "velocity_y_km_s": 7.26,
      "velocity_z_km_s": 0.0
    },
    "object2": {
      "object_id": "88888",
      "object_name": "COSMOS-2251-DEB",
      "object_type": "DEBRIS",
      "operator_organization": null,
      "ephemeris_name": "ESTIMATED",
      "covariance_method": "MONTE_CARLO",
      "maneuverable": false,
      "catalog_source": "18SDS",
      "position_x_km": 7578.637,
      "position_y_km": 0.0,
      "position_z_km": 0.0,
      "velocity_x_km_s": 0.0,
      "velocity_y_km_s": -7.25,
      "velocity_z_km_s": 0.0
    },
    "relative_state": {
      "relative_speed_m_s": 14510.0,
      "relative_position_r_km": 0.5,
      "relative_position_t_km": 0.0,
      "relative_position_n_km": 0.0
    },
    "screening_data": {
      "screening_volume_type": "ELLIPSOID",
      "hard_body_radius_m": 10.0
    }
  },
  {
    "cdm_id": "CDM-2024-003-ISS-DEBRIS",
    "creation_date": "2024-01-20T08:00:00Z",
    "originator": "JSpOC",
    "message_for": "ISS (ZARYA)",
    "tca": "2024-01-21T12:45:00Z",
    "miss_distance_m": 2500.0,
    "collision_probability": 8.5e-7,
    "object1": {
      "object_id": "25544",
      "object_name": "ISS (ZARYA)",
      "object_type": "PAYLOAD",
      "operator_organization": "NASA/ROSCOSMOS",
      "ephemeris_name": "DEFINITIVE",
      "covariance_method": "MONTE_CARLO",
      "maneuverable": true,
      "catalog_source": "18SDS",
      "position_x_km": 6778.0,
      "position_y_km": 0.0,
      "position_z_km": 0.0,
      "velocity_x_km_s": 0.0,
      "velocity_y_km_s": 7.68,
      "velocity_z_km_s": 0.0
    },
    "object2": {
      "object_id": "77777",
      "object_name": "IRIDIUM-33-DEB",
      "object_type": "DEBRIS",
      "operator_organization": null,
      "ephemeris_name": "ESTIMATED",
      "covariance_method": "MONTE_CARLO",
      "maneuverable": false,
      "catalog_source": "18SDS",
      "position_x_km": 6780.5,
      "position_y_km": 0.0,
      "position_z_km": 0.0,
      "velocity_x_km_s": 0.0,
      "velocity_y_km_s": 7.65,
      "velocity_z_km_s": 0.0
    },
    "relative_state": {
      "relative_speed_m_s": 300.0,
      "relative_position_r_km": 2.5,
      "relative_position_t_km": 0.0,
      "relative_position_n_km": 0.0
    },
    "screening_data": {
      "screening_volume_type": "ELLIPSOID",
      "hard_body_radius_m": 50.0
    }
  },
  {
    "cdm_id": "CDM-2024-004-TIANGONG-RB",
    "creation_date": "2024-01-20T16:30:00Z",
    "originator": "CNSA",
    "message_for": "TIANGONG",
    "tca": "2024-01-23T03:20:00Z",
    "miss_distance_m": 1200.0,
    "collision_probability": 3.2e-5,
    "object1": {
      "object_id": "43013",
      "object_name": "TIANGONG",
      "object_type": "PAYLOAD",
      "operator_organization": "CNSA",
      "ephemeris_name": "DEFINITIVE",
      "covariance_method": "MONTE_CARLO",
      "maneuverable": true,
      "catalog_source": "CNSA",
      "position_x_km": 6763.0,
      "position_y_km": 0.0,
      "position_z_km": 0.0,
      "velocity_x_km_s": 0.0,
      "velocity_y_km_s": 7.72,
      "velocity_z_km_s": 0.0
    },
    "object2": {
      "object_id": "66666",
      "object_name": "SL-8 R/B",
      "object_type": "ROCKET_BODY",
      "operator_organization": null,
      "ephemeris_name": "ESTIMATED",
      "covariance_method": "MONTE_CARLO",
      "maneuverable": false,
      "catalog_source": "18SDS",
      "position_x_km": 6764.2,
      "position_y_km": 0.0,
      "position_z_km": 0.0,
      "velocity_x_km_s": 0.0,
      "velocity_y_km_s": 7.5,
      "velocity_z_km_s": 0.0
    },
    "relative_state": {
      "relative_speed_m_s": 220.0,
      "relative_position_r_km": 1.2,
      "relative_position_t_km": 0.0,
      "relative_position_n_km": 0.0
    },
    "screening_data": {
      "screening_volume_type": "ELLIPSOID",
      "hard_body_radius_m": 30.0
    }
  }
]
